{
  "$schema": "https://json-schema.org/draft/2020-12/schema",
  "title": "Proposed pinned effective-policy readback descriptor",
  "type": "object",
  "additionalProperties": false,
  "required": [
    "schemaVersion",
    "profile",
    "readbackAdapter",
    "selectionState",
    "artifact",
    "declaringClass",
    "classFinal",
    "runtimeLayout",
    "fields",
    "allowedReflectionOperations",
    "privateWrites",
    "fallback",
    "jvmOpensOverride",
    "callbacks",
    "eventLoopOnly",
    "adjacentToActualHandler",
    "latchUnavailable"
  ],
  "properties": {
    "schemaVersion": {
      "const": 1
    },
    "profile": {
      "const": "bff-http1-ingress-v1"
    },
    "readbackAdapter": {
      "const": "micronaut-pipelining-readback-v1"
    },
    "selectionState": {
      "const": "PROPOSED"
    },
    "artifact": {
      "const": {
        "coordinate": "io.micronaut:micronaut-http-server-netty:5.2.20",
        "binarySha256": "379303cc7367769872506e85a7d4fce9692b2d04c6aae8bdc9f008f3c51836b4",
        "sourceJarSha256": "a7c7ba7a4819af57b5911ccfa4b0dd51364352397ad0b10a512fafc27d19686c",
        "handlerSourceSha256": "0e0be488901d9a721f7e4e5bcacff12dc1b453f3e180d71592ad2f0640721659"
      }
    },
    "declaringClass": {
      "const": "io.micronaut.http.server.netty.handler.PipeliningServerHandler"
    },
    "classFinal": {
      "const": true
    },
    "runtimeLayout": {
      "const": "unnamed-classpath-unshaded-jvm"
    },
    "fields": {
      "const": [
        {
          "name": "bodySizeLimits",
          "type": "io.micronaut.http.body.stream.BodySizeLimits",
          "modifiers": [
            "private"
          ],
          "expectedMaxBodySize": 100000000,
          "expectedMaxBufferSize": 131072
        },
        {
          "name": "requestDecompressionEnabled",
          "type": "boolean",
          "modifiers": [
            "private"
          ],
          "expectedValue": false
        }
      ]
    },
    "allowedReflectionOperations": {
      "const": [
        "getDeclaredField",
        "getDeclaringClass",
        "getType",
        "getModifiers",
        "trySetAccessible",
        "get",
        "getBoolean"
      ]
    },
    "privateWrites": {
      "const": false
    },
    "fallback": {
      "const": false
    },
    "jvmOpensOverride": {
      "const": false
    },
    "callbacks": {
      "const": [
        "channelRead",
        "channelReadComplete",
        "exceptionCaught"
      ]
    },
    "eventLoopOnly": {
      "const": true
    },
    "adjacentToActualHandler": {
      "const": true
    },
    "latchUnavailable": {
      "const": true
    }
  }
}
